{
  "id": "nangongwan",
  "displayName": "南宫婉",
  "description": "《凡人修仙传》最新蓝银造型的南宫婉桌面灵伴测试包，含六十四向伪连续鼠标注视、静立凝神、左右御风、双向遁光、日常陪伴，以及月下含栗在内的八套特效与剧情动作。",
  "spriteVersionNumber": 3,
  "spritesheetPath": "spritesheet.webp",
  "iconFrame": {
    "row": 0,
    "column": 0
  },
  "actions": {
    "idle": {
      "label": "静立凝神",
      "role": "idle",
      "row": 0,
      "frameCount": 8,
      "frameDurations": [360, 300, 120, 100, 320, 360, 360, 480],
      "loop": true,
      "showInMenu": true
    },
    "moveRight": {
      "label": "御风向右",
      "role": "move",
      "direction": "right",
      "row": 1,
      "frameCount": 8,
      "frameMs": 100,
      "loop": true,
      "autoplayWeight": 19,
      "showInMenu": true
    },
    "moveLeft": {
      "label": "御风向左",
      "role": "move",
      "direction": "left",
      "row": 2,
      "frameCount": 8,
      "frameMs": 100,
      "loop": true,
      "autoplayWeight": 19,
      "showInMenu": true
    },
    "offerVeil": {
      "label": "遗帕相赠",
      "role": "interaction",
      "row": 3,
      "frameCount": 10,
      "frameDurations": [140, 160, 180, 160, 180, 160, 160, 550, 180, 220],
      "repeatCount": 1,
      "autoplayWeight": 6,
      "cooldownMs": 45000,
      "showInMenu": true
    },
    "burstRight": {
      "label": "遁光向右",
      "role": "burstMove",
      "direction": "right",
      "row": 4,
      "frameCount": 10,
      "frameDurations": [130, 110, 90, 120, 120, 120, 120, 100, 130, 160],
      "repeatCount": 1,
      "travelStartFrame": 3,
      "travelEndFrame": 7,
      "autoplayWeight": 1,
      "cooldownMs": 45000,
      "minDistance": 280,
      "travelDistanceRatio": 0.5,
      "maxVerticalRatio": 0.1,
      "showInMenu": true
    },
    "burstLeft": {
      "label": "遁光向左",
      "role": "burstMove",
      "direction": "left",
      "row": 5,
      "frameCount": 10,
      "frameDurations": [130, 110, 90, 120, 120, 120, 120, 100, 130, 160],
      "repeatCount": 1,
      "travelStartFrame": 3,
      "travelEndFrame": 7,
      "autoplayWeight": 1,
      "cooldownMs": 45000,
      "minDistance": 280,
      "travelDistanceRatio": 0.5,
      "maxVerticalRatio": 0.1,
      "showInMenu": true
    },
    "relievedSmile": {
      "label": "释然浅笑",
      "role": "interaction",
      "row": 6,
      "frameCount": 8,
      "frameDurations": [180, 180, 180, 240, 180, 180, 450, 210],
      "repeatCount": 1,
      "autoplayWeight": 15,
      "cooldownMs": 15000,
      "showInMenu": true
    },
    "tasteCake": {
      "label": "栗糕轻尝",
      "role": "interaction",
      "row": 7,
      "frameCount": 10,
      "frameDurations": [160, 180, 180, 180, 200, 350, 220, 180, 180, 250],
      "repeatCount": 1,
      "cooldownMs": 35000,
      "showInMenu": false
    },
    "foldArms": {
      "label": "抱臂轻问",
      "role": "interaction",
      "row": 8,
      "frameCount": 8,
      "frameDurations": [170, 170, 200, 200, 400, 220, 170, 170],
      "repeatCount": 1,
      "autoplayWeight": 9,
      "cooldownMs": 22000,
      "showInMenu": true
    },
    "gatherSleeves": {
      "label": "拢袖思量",
      "role": "interaction",
      "row": 9,
      "frameCount": 8,
      "frameDurations": [160, 180, 200, 220, 300, 160, 120, 160],
      "repeatCount": 1,
      "autoplayWeight": 18,
      "cooldownMs": 12000,
      "showInMenu": false
    },
    "listen": {
      "label": "侧耳相听",
      "role": "interaction",
      "row": 10,
      "frameCount": 8,
      "frameDurations": [180, 180, 200, 500, 120, 180, 240, 300],
      "repeatCount": 1,
      "autoplayWeight": 12,
      "cooldownMs": 18000,
      "showInMenu": true
    },
    "observe": {
      "label": "回身相候",
      "role": "interaction",
      "row": 11,
      "frameCount": 10,
      "frameDurations": [160, 180, 200, 220, 180, 450, 160, 220, 180, 250],
      "repeatCount": 1,
      "autoplayWeight": 12,
      "cooldownMs": 22000,
      "showInMenu": true
    },
    "sealLight": {
      "label": "结印凝光",
      "role": "interaction",
      "row": 12,
      "frameCount": 9,
      "frameDurations": [160, 180, 180, 180, 200, 200, 320, 200, 280],
      "repeatCount": 1,
      "autoplayWeight": 6,
      "cooldownMs": 45000,
      "autoplayGroup": "spell",
      "showInMenu": true
    },
    "moonHalo": {
      "label": "月轮映身",
      "role": "interaction",
      "row": 13,
      "frameCount": 10,
      "frameDurations": [160, 180, 180, 200, 220, 220, 220, 350, 220, 250],
      "repeatCount": 1,
      "autoplayWeight": 3,
      "cooldownMs": 60000,
      "autoplayGroup": "spell",
      "showInMenu": true
    },
    "moonHover": {
      "label": "踏月悬停",
      "role": "interaction",
      "row": 14,
      "frameCount": 10,
      "frameDurations": [160, 160, 180, 180, 180, 350, 180, 180, 180, 250],
      "repeatCount": 1,
      "autoplayWeight": 3,
      "cooldownMs": 65000,
      "autoplayGroup": "spell",
      "showInMenu": true
    },
    "starGather": {
      "label": "引星凝辉",
      "role": "interaction",
      "row": 15,
      "frameCount": 9,
      "frameDurations": [160, 180, 180, 200, 220, 320, 220, 180, 240],
      "repeatCount": 1,
      "autoplayWeight": 3,
      "cooldownMs": 55000,
      "autoplayGroup": "spell",
      "showInMenu": true
    },
    "moonPulse": {
      "label": "月轮震辉",
      "role": "interaction",
      "row": 16,
      "frameCount": 10,
      "frameDurations": [160, 180, 180, 200, 220, 240, 400, 240, 220, 260],
      "repeatCount": 1,
      "autoplayWeight": 3,
      "cooldownMs": 75000,
      "autoplayGroup": "spell",
      "showInMenu": true
    },
    "divinePillars": {
      "label": "神光垂落",
      "role": "interaction",
      "row": 17,
      "frameCount": 10,
      "frameDurations": [160, 180, 190, 210, 230, 250, 420, 240, 220, 280],
      "repeatCount": 1,
      "autoplayWeight": 3,
      "cooldownMs": 120000,
      "autoplayGroup": "spell",
      "showInMenu": true
    },
    "reincarnationLight": {
      "label": "轮回神光",
      "role": "interaction",
      "row": 18,
      "frameCount": 10,
      "frameDurations": [180, 180, 200, 220, 240, 260, 550, 260, 260, 300],
      "repeatCount": 1,
      "autoplayWeight": 3,
      "cooldownMs": 180000,
      "autoplayGroup": "spell",
      "showInMenu": true
    },
    "moonlitChestnut": {
      "label": "月下含栗",
      "role": "interaction",
      "row": 23,
      "frameCount": 48,
      "frameDurations": [140, 140, 150, 170, 150, 160, 170, 180, 190, 200, 170, 170, 180, 180, 190, 190, 200, 200, 210, 210, 170, 180, 190, 200, 210, 160, 170, 180, 190, 200, 210, 220, 220, 170, 180, 190, 210, 240, 260, 200, 220, 240, 260, 290, 340, 200, 250, 300],
      "repeatCount": 1,
      "autoplayWeight": 5,
      "cooldownMs": 90000,
      "showInMenu": true
    },
    "gaze": {
      "label": "随眸相望",
      "role": "gaze",
      "row": 19,
      "frameCount": 64,
      "frameMs": 100,
      "showInMenu": false
    }
  }
}
